<?xml version="1.0"?>
<!DOCTYPE Report
[
<!ELEMENT Report (General ,(Doc|BPT)) >
<!ATTLIST Report ver CDATA #REQUIRED tmZone CDATA #REQUIRED>

<!ELEMENT General ( DocLocation ) >
<!ATTLIST General productName CDATA #REQUIRED productVer CDATA #REQUIRED os CDATA #REQUIRED host CDATA #REQUIRED qcserver CDATA #IMPLIED qcproject CDATA #IMPLIED SolManSolutionId CDATA #IMPLIED SolManProjectId CDATA #IMPLIED SolManTestPlanId CDATA #IMPLIED SolManTestPackageId CDATA #IMPLIED SolManUserInfoData CDATA #IMPLIED  >

<!ELEMENT BPT (DName,Res,DVer?,TSet?,TInst?,NodeArgs,AdditionalInfo*,Doc*) >
<!ATTLIST BPT rID ID #REQUIRED >

<!ELEMENT Doc (DName,ConfName?,Res,DVer?,TSet?,TInst?,RunType?,DT?,AdditionalInfo*,Step*,DIter*,Step*,Action*,Doc*,Summary?,TestMaintenanceSummary*,NodeArgs?) >
<!ATTLIST Doc rID ID #REQUIRED type (Test|BC|BPTWrapperTest|Flow|Group|Action) "Test" productName CDATA #REQUIRED BCIter CDATA #IMPLIED >

<!ELEMENT RunType ( #PCDATA )>
<!ATTLIST RunType fmStep (False|True) "False" batch (False|True) "False" upDesc (False|True) "False" upChk (False|True) "False" upAS (False|True) "False">

<!ELEMENT DName ( #PCDATA ) >

<!ELEMENT ConfName ( #PCDATA ) >

<!ELEMENT Res ( #PCDATA ) >

<!ELEMENT AdditionalInfo (AdditionalDataName,AdditionalDataValue ) >

<!ELEMENT AdditionalDataName ( #PCDATA ) >

<!ELEMENT AdditionalDataValue ( #PCDATA ) >

<!ELEMENT DVer ( #PCDATA ) >

<!ELEMENT TSet ( #PCDATA ) >

<!ELEMENT TInst ( #PCDATA ) >

<!ELEMENT DIter (Step*,Action+,Summary?,NodeArgs)>
<!ATTLIST DIter rID ID #REQUIRED iterID CDATA #REQUIRED>

<!ELEMENT DocLocation ( #PCDATA )>

<!ELEMENT Action (AName,AIter*,(Step|HtmlStep|Action)*, Summary,ActionMaintenanceSummary*, NodeArgs ) >
<!ATTLIST Action rID ID #REQUIRED>

<!ELEMENT AIter ((Step|HtmlStep|Action)*,DataMapping?, Summary?,NodeArgs) >
<!ATTLIST AIter rID ID #REQUIRED iterID CDATA #REQUIRED isCountable (False|True) "False" >

<!ELEMENT AName ( #PCDATA ) >

<!ELEMENT TestMaintenanceSummary (ActionMaintenanceSummary*) >
<!ATTLIST TestMaintenanceSummary ObjectsAdded CDATA #REQUIRED ObjectsUpdated CDATA #REQUIRED StepsUpdated CDATA #REQUIRED StepsComments CDATA #REQUIRED><!ELEMENT ActionMaintenanceSummary (ObjectChange* ) >
<!ATTLIST ActionMaintenanceSummary Action CDATA #REQUIRED Objects CDATA #REQUIRED Updated CDATA #REQUIRED LinesTotal CDATA #REQUIRED Added CDATA #REQUIRED LinesUpdated CDATA #REQUIRED>

<!ELEMENT ObjectChange  (Hierarchy, PropertyChangeList* ) >
<!ATTLIST ObjectChange Operation CDATA #IMPLIED OriginalRepository CDATA #IMPLIED>

<!ELEMENT PropertyChangeList (PropertyDef*) >

<!ELEMENT PropertyDef (OriginalValue, NewValue) >
<!ATTLIST PropertyDef PropName CDATA #REQUIRED OriginRegularExpression (True|False) "False" NewRegularExpression (True|False) "False" AddedProperty (True|False) "False" >

<!ELEMENT OriginalValue ( #PCDATA )>

<!ELEMENT NewValue ( #PCDATA )>

<!ELEMENT Hierarchy  (ObjectName, Hierarchy*) >
<!ATTLIST Hierarchy MicClass CDATA #REQUIRED>

<!ELEMENT ObjectName  ( #PCDATA ) >

<!ELEMENT Step (Obj,Details,Time,TimeTick* ,(Step|HtmlStep|Doc)*, DataMapping?, NodeArgs) >
<!ATTLIST Step rID ID #REQUIRED retval CDATA #IMPLIED>

<!ELEMENT HtmlStep (HTML,TimeTick*,(Step|HtmlStep|Doc)*,NodeArgs) >
<!ATTLIST HtmlStep rID ID #REQUIRED >

<!ELEMENT Obj ( #PCDATA ) >
<!ATTLIST Obj plainTxt (False|True) "True">

<!ELEMENT Details ( #PCDATA ) >
<!ATTLIST Details plainTxt (False|True) "True">

<!ELEMENT Time ( #PCDATA ) >

<!ELEMENT HTML ( #PCDATA ) >

<!ELEMENT Disp ( #PCDATA ) >

<!ELEMENT TimeTick ( #PCDATA ) >

<!ELEMENT DataMapping ( DataMappedItem* )>
<!ELEMENT DataMappedItem EMPTY >
<!ATTLIST DataMappedItem dsName CDATA #REQUIRED >
<!ATTLIST DataMappedItem rowId CDATA #REQUIRED >

<!ELEMENT NodeArgs (Disp,TopPane?,BtmPane?,ExtendedInfo? )>
<!ATTLIST NodeArgs eType CDATA #REQUIRED icon CDATA #REQUIRED nRep CDATA #REQUIRED UserNote CDATA #IMPLIED filter (False|True) "True">
<!ATTLIST NodeArgs status (Passed|Failed|Done|Warning|Information) "Done">
<!ATTLIST NodeArgs iconSel CDATA #IMPLIED nType CDATA #IMPLIED MovieMarker CDATA "">
<!ATTLIST NodeArgs Source CDATA #IMPLIED SourceLine CDATA #IMPLIED StepFlowItemKey CDATA #IMPLIED >

<!ELEMENT TopPane (Path)>

<!ELEMENT BtmPane ( (Path|WR)?,ASHilite?)>
<!ATTLIST BtmPane vType CDATA "HTML">

<!ELEMENT Path ( #PCDATA ) >

<!ELEMENT ASHilite ( #PCDATA ) >

<!ELEMENT WR ( #PCDATA ) >

<!ELEMENT ExtendedInfo ( StepData ) >

<!ATTLIST ExtendedInfo StepType CDATA #REQUIRED>
<!ELEMENT DT (NodeArgs) >
<!ATTLIST DT rID ID #REQUIRED>

<!ELEMENT Summary (Param*)>
<!ATTLIST Summary sTime CDATA #IMPLIED eTime CDATA #IMPLIED passed CDATA #IMPLIED failed CDATA #IMPLIED warnings CDATA #IMPLIED retval CDATA #IMPLIED stopped (False|True) "False" >

<!ELEMENT Param (ParamName,ParamVal)+ >
<!ATTLIST Param paramInOut (In|Out) "In">

<!ELEMENT ParamName ( #PCDATA ) >

<!ELEMENT ParamVal ( #PCDATA ) >

]
>
<Report ver="2.0" tmZone="Central Standard Time">
<General productName="HP Unified Functional Testing" productVer="12.02" os="Windows 7" host="GREGORYJ01"><DocLocation><![CDATA[D:\PROJECT_FOLDER\Testscripts\ReviewMedications]]></DocLocation></General>
<Doc rID="T1"   productName= "HP Unified Functional Testing"  >
<DName><![CDATA[ReviewMedications]]></DName>
<Res><![CDATA[Res8]]></Res>
<DT rID="T2">
<NodeArgs eType="Table" icon="2" nRep="4" filter="False" >
<Disp><![CDATA[Run-Time Data Table]]></Disp>
<BtmPane vType="Table" >
<Path><![CDATA[Default.xls]]></Path>
</BtmPane>
</NodeArgs>
</DT>
<DIter rID="T3" iterID="1" >
<Action rID="T4">
<AName><![CDATA[Action1]]></AName>
<Step rID="T5">
<Obj plainTxt="False" ><![CDATA[LoadFunctionLibrary]]></Obj>
<Details plainTxt="False" ><![CDATA[LoadFunctionLibrary function passed]]></Details>
<Time><![CDATA[11/17/2015 - 21:59:43]]></Time>
<TimeTick>1447819183</TimeTick>
<NodeArgs eType="Replay" icon="5" nRep="8" status="Passed" Source="Action1" SourceLine="21" >
<Disp><![CDATA[LoadFunctionLibrary]]></Disp>
</NodeArgs>
</Step>
<Step rID="T6">
<Obj plainTxt="False" ><![CDATA[LoadFunctionLibrary]]></Obj>
<Details plainTxt="False" ><![CDATA[LoadFunctionLibrary function passed]]></Details>
<Time><![CDATA[11/17/2015 - 21:59:44]]></Time>
<TimeTick>1447819184</TimeTick>
<NodeArgs eType="Replay" icon="5" nRep="9" status="Passed" Source="Action1" SourceLine="21" >
<Disp><![CDATA[LoadFunctionLibrary]]></Disp>
</NodeArgs>
</Step>
<Step rID="T7">
<Obj plainTxt="False" ><![CDATA[LoadFunctionLibrary]]></Obj>
<Details plainTxt="False" ><![CDATA[LoadFunctionLibrary function passed]]></Details>
<Time><![CDATA[11/17/2015 - 21:59:44]]></Time>
<TimeTick>1447819184</TimeTick>
<NodeArgs eType="Replay" icon="5" nRep="10" status="Passed" Source="Action1" SourceLine="21" >
<Disp><![CDATA[LoadFunctionLibrary]]></Disp>
</NodeArgs>
</Step>
<Step rID="T8">
<Obj plainTxt="False" ><![CDATA[[ Medications ].Click]]></Obj>
<Details plainTxt="False" ><![CDATA[]]></Details>
<Time><![CDATA[11/17/2015 - 21:59:45]]></Time>
<TimeTick>1447819185</TimeTick>
<NodeArgs eType="Replay" icon="6" nRep="13" >
<Disp><![CDATA[[ Medications ].Click]]></Disp>
</NodeArgs>
</Step>
<Step rID="T9">
<Obj plainTxt="False" ><![CDATA[[ Ok ].Click]]></Obj>
<Details plainTxt="False" ><![CDATA[]]></Details>
<Time><![CDATA[11/17/2015 - 21:59:51]]></Time>
<TimeTick>1447819191</TimeTick>
<NodeArgs eType="Replay" icon="7" nRep="17" >
<Disp><![CDATA[[ Ok ].Click]]></Disp>
</NodeArgs>
</Step>
<Step rID="T10">
<Obj plainTxt="False" ><![CDATA[[ Ok ].Click]]></Obj>
<Details plainTxt="False" ><![CDATA[]]></Details>
<Time><![CDATA[11/17/2015 - 21:59:58]]></Time>
<TimeTick>1447819198</TimeTick>
<NodeArgs eType="Replay" icon="7" nRep="20" >
<Disp><![CDATA[[ Ok ].Click]]></Disp>
</NodeArgs>
</Step>
<Step rID="T11">
<Obj plainTxt="False" ><![CDATA[[ Medications Management  ].Exist]]></Obj>
<Details plainTxt="False" ><![CDATA["Object exists"]]></Details>
<Time><![CDATA[11/17/2015 - 22:00:06]]></Time>
<TimeTick>1447819206</TimeTick>
<NodeArgs eType="Replay" icon="8" nRep="23" Source="Action1" SourceLine="118" >
<Disp><![CDATA[[ Medications Management  ].Exist]]></Disp>
</NodeArgs>
</Step>
<Step rID="T12">
<Obj plainTxt="False" ><![CDATA[[ Avodart Oral Capsule 0.5 MG ].Exist]]></Obj>
<Details plainTxt="False" ><![CDATA["Object exists"]]></Details>
<Time><![CDATA[11/17/2015 - 22:00:08]]></Time>
<TimeTick>1447819208</TimeTick>
<NodeArgs eType="Replay" icon="9" nRep="25" Source="Action1" SourceLine="131" >
<Disp><![CDATA[[ Avodart Oral Capsule 0.5 MG ].Exist]]></Disp>
</NodeArgs>
</Step>
<Step rID="T13">
<Obj plainTxt="False" ><![CDATA["[ Avodart Oral Capsule 0.5 MG ]":Function Call]]></Obj>
<Details plainTxt="False" ><![CDATA[ChildItem]]></Details>
<Time><![CDATA[11/17/2015 - 22:00:08]]></Time>
<TimeTick>1447819208</TimeTick>
<NodeArgs eType="General" icon="9" nRep="26" >
<Disp><![CDATA["[ Avodart Oral Capsule 0.5 MG ]":Function Call]]></Disp>
</NodeArgs>
</Step>
<Step rID="T14">
<Obj plainTxt="False" ><![CDATA["[ Avodart Oral Capsule 0.5 MG ]":Function Call]]></Obj>
<Details plainTxt="False" ><![CDATA[RowCount]]></Details>
<Time><![CDATA[11/17/2015 - 22:00:08]]></Time>
<TimeTick>1447819208</TimeTick>
<NodeArgs eType="General" icon="9" nRep="27" >
<Disp><![CDATA["[ Avodart Oral Capsule 0.5 MG ]":Function Call]]></Disp>
</NodeArgs>
</Step>
<Step rID="T15">
<Obj plainTxt="False" ><![CDATA["[ Avodart Oral Capsule 0.5 MG ]":Function Call]]></Obj>
<Details plainTxt="False" ><![CDATA[ChildItem]]></Details>
<Time><![CDATA[11/17/2015 - 22:00:08]]></Time>
<TimeTick>1447819208</TimeTick>
<NodeArgs eType="General" icon="9" nRep="28" >
<Disp><![CDATA["[ Avodart Oral Capsule 0.5 MG ]":Function Call]]></Disp>
</NodeArgs>
</Step>
<Step rID="T16">
<Obj plainTxt="False" ><![CDATA[[ WebElement ].Click]]></Obj>
<Details plainTxt="False" ><![CDATA[]]></Details>
<Time><![CDATA[11/17/2015 - 22:00:08]]></Time>
<TimeTick>1447819208</TimeTick>
<NodeArgs eType="Replay" icon="8" nRep="30" Source="Action1" SourceLine="137" >
<Disp><![CDATA[[ WebElement ].Click]]></Disp>
</NodeArgs>
</Step>
<Step rID="T17">
<Obj plainTxt="False" ><![CDATA[[   Add ].Exist]]></Obj>
<Details plainTxt="False" ><![CDATA["Object exists"]]></Details>
<Time><![CDATA[11/17/2015 - 22:00:08]]></Time>
<TimeTick>1447819208</TimeTick>
<NodeArgs eType="Replay" icon="8" nRep="32" >
<Disp><![CDATA[[   Add ].Exist]]></Disp>
</NodeArgs>
</Step>
<Step rID="T18">
<Obj plainTxt="False" ><![CDATA[[   Add ].Click]]></Obj>
<Details plainTxt="False" ><![CDATA[]]></Details>
<Time><![CDATA[11/17/2015 - 22:00:08]]></Time>
<TimeTick>1447819208</TimeTick>
<NodeArgs eType="Replay" icon="8" nRep="34" >
<Disp><![CDATA[[   Add ].Click]]></Disp>
</NodeArgs>
</Step>
<Step rID="T19">
<Obj plainTxt="False" ><![CDATA[[   ].Click]]></Obj>
<Details plainTxt="False" ><![CDATA[]]></Details>
<Time><![CDATA[11/17/2015 - 22:00:13]]></Time>
<TimeTick>1447819213</TimeTick>
<NodeArgs eType="Replay" icon="8" nRep="38" Source="Action1" SourceLine="171" >
<Disp><![CDATA[[   ].Click]]></Disp>
</NodeArgs>
</Step>
<Step rID="T20">
<Obj plainTxt="False" ><![CDATA[[ Hematide ].Click]]></Obj>
<Details plainTxt="False" ><![CDATA[]]></Details>
<Time><![CDATA[11/17/2015 - 22:00:26]]></Time>
<TimeTick>1447819226</TimeTick>
<NodeArgs eType="Replay" icon="6" nRep="42" >
<Disp><![CDATA[[ Hematide ].Click]]></Disp>
</NodeArgs>
</Step>
<Step rID="T21">
<Obj plainTxt="False" ><![CDATA[[ WebEdit ].Set]]></Obj>
<Details plainTxt="False" ><![CDATA["11/10/2015"]]></Details>
<Time><![CDATA[11/17/2015 - 22:00:29]]></Time>
<TimeTick>1447819229</TimeTick>
<NodeArgs eType="Replay" icon="10" nRep="45" Source="Action1" SourceLine="191" >
<Disp><![CDATA[[ WebEdit ].Set]]></Disp>
</NodeArgs>
</Step>
<Step rID="T22">
<Obj plainTxt="False" ><![CDATA[[ WebEdit ].Set]]></Obj>
<Details plainTxt="False" ><![CDATA["11/10/2015"]]></Details>
<Time><![CDATA[11/17/2015 - 22:00:30]]></Time>
<TimeTick>1447819230</TimeTick>
<NodeArgs eType="Replay" icon="10" nRep="48" Source="Action1" SourceLine="201" >
<Disp><![CDATA[[ WebEdit ].Set]]></Disp>
</NodeArgs>
</Step>
<Step rID="T23">
<Obj plainTxt="False" ><![CDATA[[   ].Click]]></Obj>
<Details plainTxt="False" ><![CDATA[]]></Details>
<Time><![CDATA[11/17/2015 - 22:00:31]]></Time>
<TimeTick>1447819231</TimeTick>
<NodeArgs eType="Replay" icon="7" nRep="51" >
<Disp><![CDATA[[   ].Click]]></Disp>
</NodeArgs>
</Step>
<Step rID="T24">
<Obj plainTxt="False" ><![CDATA[[ AFTER EATING ].Click]]></Obj>
<Details plainTxt="False" ><![CDATA[]]></Details>
<Time><![CDATA[11/17/2015 - 22:00:34]]></Time>
<TimeTick>1447819234</TimeTick>
<NodeArgs eType="Replay" icon="6" nRep="54" >
<Disp><![CDATA[[ AFTER EATING ].Click]]></Disp>
</NodeArgs>
</Step>
<Step rID="T25">
<Obj plainTxt="False" ><![CDATA[[  Save   ].Exist]]></Obj>
<Details plainTxt="False" ><![CDATA["Object exists"]]></Details>
<Time><![CDATA[11/17/2015 - 22:00:37]]></Time>
<TimeTick>1447819237</TimeTick>
<NodeArgs eType="Replay" icon="8" nRep="56" >
<Disp><![CDATA[[  Save   ].Exist]]></Disp>
</NodeArgs>
</Step>
<Step rID="T26">
<Obj plainTxt="False" ><![CDATA[[  Save   ].Click]]></Obj>
<Details plainTxt="False" ><![CDATA[]]></Details>
<Time><![CDATA[11/17/2015 - 22:00:37]]></Time>
<TimeTick>1447819237</TimeTick>
<NodeArgs eType="Replay" icon="8" nRep="58" >
<Disp><![CDATA[[  Save   ].Click]]></Disp>
</NodeArgs>
</Step>
<Step rID="T27">
<Obj plainTxt="False" ><![CDATA[[ Processing... ].Exist]]></Obj>
<Details plainTxt="False" ><![CDATA["Object exists"]]></Details>
<Time><![CDATA[11/17/2015 - 22:00:37]]></Time>
<TimeTick>1447819237</TimeTick>
<NodeArgs eType="Replay" icon="8" nRep="59" Source="Action1" SourceLine="671" >
<Disp><![CDATA[[ Processing... ].Exist]]></Disp>
</NodeArgs>
</Step>
<Step rID="T28">
<Obj plainTxt="False" ><![CDATA[[ Processing... ].Exist]]></Obj>
<Details plainTxt="False" ><![CDATA["Object exists"]]></Details>
<Time><![CDATA[11/17/2015 - 22:00:39]]></Time>
<TimeTick>1447819239</TimeTick>
<NodeArgs eType="Replay" icon="8" nRep="60" Source="Action1" SourceLine="671" >
<Disp><![CDATA[[ Processing... ].Exist]]></Disp>
</NodeArgs>
</Step>
<Step rID="T29">
<Obj plainTxt="False" ><![CDATA[[ WebElement ].Exist]]></Obj>
<Details plainTxt="False" ><![CDATA["Object does not exist"]]></Details>
<Time><![CDATA[11/17/2015 - 22:00:41]]></Time>
<TimeTick>1447819241</TimeTick>
<NodeArgs eType="Replay" icon="8" nRep="65" Source="Action1" SourceLine="671" >
<Disp><![CDATA[[ WebElement ].Exist]]></Disp>
</NodeArgs>
</Step>
<Step rID="T30">
<Obj plainTxt="False" ><![CDATA["[ Avodart Oral Capsule 0.5 MG ]":Function Call]]></Obj>
<Details plainTxt="False" ><![CDATA[RowCount]]></Details>
<Time><![CDATA[11/17/2015 - 22:00:43]]></Time>
<TimeTick>1447819243</TimeTick>
<NodeArgs eType="General" icon="9" nRep="66" >
<Disp><![CDATA["[ Avodart Oral Capsule 0.5 MG ]":Function Call]]></Disp>
</NodeArgs>
</Step>
<Step rID="T31">
<Obj plainTxt="False" ><![CDATA["[ Avodart Oral Capsule 0.5 MG ]":Function Call]]></Obj>
<Details plainTxt="False" ><![CDATA[ChildItem]]></Details>
<Time><![CDATA[11/17/2015 - 22:00:43]]></Time>
<TimeTick>1447819243</TimeTick>
<NodeArgs eType="General" icon="9" nRep="67" >
<Disp><![CDATA["[ Avodart Oral Capsule 0.5 MG ]":Function Call]]></Disp>
</NodeArgs>
</Step>
<Step rID="T32">
<Obj plainTxt="False" ><![CDATA["[ Avodart Oral Capsule 0.5 MG ]":Function Call]]></Obj>
<Details plainTxt="False" ><![CDATA[ChildItem]]></Details>
<Time><![CDATA[11/17/2015 - 22:00:43]]></Time>
<TimeTick>1447819243</TimeTick>
<NodeArgs eType="General" icon="9" nRep="68" >
<Disp><![CDATA["[ Avodart Oral Capsule 0.5 MG ]":Function Call]]></Disp>
</NodeArgs>
</Step>
<Step rID="T33">
<Obj plainTxt="False" ><![CDATA["[ Avodart Oral Capsule 0.5 MG ]":Function Call]]></Obj>
<Details plainTxt="False" ><![CDATA[ChildItem]]></Details>
<Time><![CDATA[11/17/2015 - 22:00:43]]></Time>
<TimeTick>1447819243</TimeTick>
<NodeArgs eType="General" icon="9" nRep="69" >
<Disp><![CDATA["[ Avodart Oral Capsule 0.5 MG ]":Function Call]]></Disp>
</NodeArgs>
</Step>
<Step rID="T34">
<Obj plainTxt="False" ><![CDATA["[ Avodart Oral Capsule 0.5 MG ]":Function Call]]></Obj>
<Details plainTxt="False" ><![CDATA[ChildItem]]></Details>
<Time><![CDATA[11/17/2015 - 22:00:43]]></Time>
<TimeTick>1447819243</TimeTick>
<NodeArgs eType="General" icon="9" nRep="70" >
<Disp><![CDATA["[ Avodart Oral Capsule 0.5 MG ]":Function Call]]></Disp>
</NodeArgs>
</Step>
<Step rID="T35">
<Obj plainTxt="False" ><![CDATA["[ Avodart Oral Capsule 0.5 MG ]":Function Call]]></Obj>
<Details plainTxt="False" ><![CDATA[ChildItem]]></Details>
<Time><![CDATA[11/17/2015 - 22:00:43]]></Time>
<TimeTick>1447819243</TimeTick>
<NodeArgs eType="General" icon="9" nRep="71" >
<Disp><![CDATA["[ Avodart Oral Capsule 0.5 MG ]":Function Call]]></Disp>
</NodeArgs>
</Step>
<Step rID="T36">
<Obj plainTxt="False" ><![CDATA["[ Avodart Oral Capsule 0.5 MG ]":Function Call]]></Obj>
<Details plainTxt="False" ><![CDATA[ChildItem]]></Details>
<Time><![CDATA[11/17/2015 - 22:00:43]]></Time>
<TimeTick>1447819243</TimeTick>
<NodeArgs eType="General" icon="9" nRep="72" >
<Disp><![CDATA["[ Avodart Oral Capsule 0.5 MG ]":Function Call]]></Disp>
</NodeArgs>
</Step>
<Step rID="T37">
<Obj plainTxt="False" ><![CDATA["[ Avodart Oral Capsule 0.5 MG ]":Function Call]]></Obj>
<Details plainTxt="False" ><![CDATA[ChildItem]]></Details>
<Time><![CDATA[11/17/2015 - 22:00:43]]></Time>
<TimeTick>1447819243</TimeTick>
<NodeArgs eType="General" icon="9" nRep="73" >
<Disp><![CDATA["[ Avodart Oral Capsule 0.5 MG ]":Function Call]]></Disp>
</NodeArgs>
</Step>
<Step rID="T38">
<Obj plainTxt="False" ><![CDATA["[ Avodart Oral Capsule 0.5 MG ]":Function Call]]></Obj>
<Details plainTxt="False" ><![CDATA[ChildItem]]></Details>
<Time><![CDATA[11/17/2015 - 22:00:43]]></Time>
<TimeTick>1447819243</TimeTick>
<NodeArgs eType="General" icon="9" nRep="74" >
<Disp><![CDATA["[ Avodart Oral Capsule 0.5 MG ]":Function Call]]></Disp>
</NodeArgs>
</Step>
<Step rID="T39">
<Obj plainTxt="False" ><![CDATA["[ Avodart Oral Capsule 0.5 MG ]":Function Call]]></Obj>
<Details plainTxt="False" ><![CDATA[ChildItem]]></Details>
<Time><![CDATA[11/17/2015 - 22:00:43]]></Time>
<TimeTick>1447819243</TimeTick>
<NodeArgs eType="General" icon="9" nRep="75" >
<Disp><![CDATA["[ Avodart Oral Capsule 0.5 MG ]":Function Call]]></Disp>
</NodeArgs>
</Step>
<Step rID="T40">
<Obj plainTxt="False" ><![CDATA["[ Avodart Oral Capsule 0.5 MG ]":Function Call]]></Obj>
<Details plainTxt="False" ><![CDATA[ChildItem]]></Details>
<Time><![CDATA[11/17/2015 - 22:00:43]]></Time>
<TimeTick>1447819243</TimeTick>
<NodeArgs eType="General" icon="9" nRep="76" >
<Disp><![CDATA["[ Avodart Oral Capsule 0.5 MG ]":Function Call]]></Disp>
</NodeArgs>
</Step>
<Step rID="T41">
<Obj plainTxt="False" ><![CDATA["[ Avodart Oral Capsule 0.5 MG ]":Function Call]]></Obj>
<Details plainTxt="False" ><![CDATA[ChildItem]]></Details>
<Time><![CDATA[11/17/2015 - 22:00:44]]></Time>
<TimeTick>1447819244</TimeTick>
<NodeArgs eType="General" icon="9" nRep="77" >
<Disp><![CDATA["[ Avodart Oral Capsule 0.5 MG ]":Function Call]]></Disp>
</NodeArgs>
</Step>
<Step rID="T42">
<Obj plainTxt="False" ><![CDATA["[ Avodart Oral Capsule 0.5 MG ]":Function Call]]></Obj>
<Details plainTxt="False" ><![CDATA[ChildItem]]></Details>
<Time><![CDATA[11/17/2015 - 22:00:44]]></Time>
<TimeTick>1447819244</TimeTick>
<NodeArgs eType="General" icon="9" nRep="78" >
<Disp><![CDATA["[ Avodart Oral Capsule 0.5 MG ]":Function Call]]></Disp>
</NodeArgs>
</Step>
<Step rID="T43">
<Obj plainTxt="False" ><![CDATA["[ Avodart Oral Capsule 0.5 MG ]":Function Call]]></Obj>
<Details plainTxt="False" ><![CDATA[ChildItem]]></Details>
<Time><![CDATA[11/17/2015 - 22:00:44]]></Time>
<TimeTick>1447819244</TimeTick>
<NodeArgs eType="General" icon="9" nRep="79" >
<Disp><![CDATA["[ Avodart Oral Capsule 0.5 MG ]":Function Call]]></Disp>
</NodeArgs>
</Step>
<Step rID="T44">
<Obj plainTxt="False" ><![CDATA["[ Avodart Oral Capsule 0.5 MG ]":Function Call]]></Obj>
<Details plainTxt="False" ><![CDATA[ChildItem]]></Details>
<Time><![CDATA[11/17/2015 - 22:00:44]]></Time>
<TimeTick>1447819244</TimeTick>
<NodeArgs eType="General" icon="9" nRep="80" >
<Disp><![CDATA["[ Avodart Oral Capsule 0.5 MG ]":Function Call]]></Disp>
</NodeArgs>
</Step>
<Step rID="T45">
<Obj plainTxt="False" ><![CDATA["[ Avodart Oral Capsule 0.5 MG ]":Function Call]]></Obj>
<Details plainTxt="False" ><![CDATA[RowCount]]></Details>
<Time><![CDATA[11/17/2015 - 22:00:45]]></Time>
<TimeTick>1447819245</TimeTick>
<NodeArgs eType="General" icon="9" nRep="81" >
<Disp><![CDATA["[ Avodart Oral Capsule 0.5 MG ]":Function Call]]></Disp>
</NodeArgs>
</Step>
<Step rID="T46">
<Obj plainTxt="False" ><![CDATA["[ Avodart Oral Capsule 0.5 MG ]":Function Call]]></Obj>
<Details plainTxt="False" ><![CDATA[ChildItem]]></Details>
<Time><![CDATA[11/17/2015 - 22:00:45]]></Time>
<TimeTick>1447819245</TimeTick>
<NodeArgs eType="General" icon="9" nRep="82" >
<Disp><![CDATA["[ Avodart Oral Capsule 0.5 MG ]":Function Call]]></Disp>
</NodeArgs>
</Step>
<Step rID="T47">
<Obj plainTxt="False" ><![CDATA[[ Avodart Oral Capsule 0.5 MG ].Fire Web Event]]></Obj>
<Details plainTxt="False" ><![CDATA["onClick"]]></Details>
<Time><![CDATA[11/17/2015 - 22:00:45]]></Time>
<TimeTick>1447819245</TimeTick>
<NodeArgs eType="Replay" icon="8" nRep="84" Source="Action1" SourceLine="272" >
<Disp><![CDATA[[ Avodart Oral Capsule 0.5 MG ].Fire Web Event]]></Disp>
</NodeArgs>
</Step>
<Step rID="T48">
<Obj plainTxt="False" ><![CDATA[[ WebElement ].Exist]]></Obj>
<Details plainTxt="False" ><![CDATA["Object does not exist"]]></Details>
<Time><![CDATA[11/17/2015 - 22:00:46]]></Time>
<TimeTick>1447819246</TimeTick>
<NodeArgs eType="Replay" icon="8" nRep="92" Source="Action1" SourceLine="274" >
<Disp><![CDATA[[ WebElement ].Exist]]></Disp>
</NodeArgs>
</Step>
<Step rID="T49">
<Obj plainTxt="False" ><![CDATA["[ Avodart Oral Capsule 0.5 MG ]":Function Call]]></Obj>
<Details plainTxt="False" ><![CDATA[ChildItem]]></Details>
<Time><![CDATA[11/17/2015 - 22:00:46]]></Time>
<TimeTick>1447819246</TimeTick>
<NodeArgs eType="General" icon="9" nRep="93" >
<Disp><![CDATA["[ Avodart Oral Capsule 0.5 MG ]":Function Call]]></Disp>
</NodeArgs>
</Step>
<Step rID="T50">
<Obj plainTxt="False" ><![CDATA[[ Nephrocaps Oral Capsule 1 MG ].Fire Web Event]]></Obj>
<Details plainTxt="False" ><![CDATA["onClick"]]></Details>
<Time><![CDATA[11/17/2015 - 22:00:46]]></Time>
<TimeTick>1447819246</TimeTick>
<NodeArgs eType="Replay" icon="8" nRep="95" Source="Action1" SourceLine="272" >
<Disp><![CDATA[[ Nephrocaps Oral Capsule 1 MG ].Fire Web Event]]></Disp>
</NodeArgs>
</Step>
<Step rID="T51">
<Obj plainTxt="False" ><![CDATA[[ WebElement ].Exist]]></Obj>
<Details plainTxt="False" ><![CDATA["Object does not exist"]]></Details>
<Time><![CDATA[11/17/2015 - 22:00:48]]></Time>
<TimeTick>1447819248</TimeTick>
<NodeArgs eType="Replay" icon="8" nRep="103" Source="Action1" SourceLine="274" >
<Disp><![CDATA[[ WebElement ].Exist]]></Disp>
</NodeArgs>
</Step>
<Step rID="T52">
<Obj plainTxt="False" ><![CDATA["[ Avodart Oral Capsule 0.5 MG ]":Function Call]]></Obj>
<Details plainTxt="False" ><![CDATA[ChildItem]]></Details>
<Time><![CDATA[11/17/2015 - 22:00:48]]></Time>
<TimeTick>1447819248</TimeTick>
<NodeArgs eType="General" icon="9" nRep="104" >
<Disp><![CDATA["[ Avodart Oral Capsule 0.5 MG ]":Function Call]]></Disp>
</NodeArgs>
</Step>
<Step rID="T53">
<Obj plainTxt="False" ><![CDATA[[ Gabapentin Oral Capsule 100 MG ].Fire Web Event]]></Obj>
<Details plainTxt="False" ><![CDATA["onClick"]]></Details>
<Time><![CDATA[11/17/2015 - 22:00:48]]></Time>
<TimeTick>1447819248</TimeTick>
<NodeArgs eType="Replay" icon="8" nRep="106" Source="Action1" SourceLine="272" >
<Disp><![CDATA[[ Gabapentin Oral Capsule 100 MG ].Fire Web Event]]></Disp>
</NodeArgs>
</Step>
<Step rID="T54">
<Obj plainTxt="False" ><![CDATA[[ WebElement ].Exist]]></Obj>
<Details plainTxt="False" ><![CDATA["Object does not exist"]]></Details>
<Time><![CDATA[11/17/2015 - 22:00:49]]></Time>
<TimeTick>1447819249</TimeTick>
<NodeArgs eType="Replay" icon="8" nRep="113" Source="Action1" SourceLine="274" >
<Disp><![CDATA[[ WebElement ].Exist]]></Disp>
</NodeArgs>
</Step>
<Step rID="T55">
<Obj plainTxt="False" ><![CDATA["[ Avodart Oral Capsule 0.5 MG ]":Function Call]]></Obj>
<Details plainTxt="False" ><![CDATA[ChildItem]]></Details>
<Time><![CDATA[11/17/2015 - 22:00:49]]></Time>
<TimeTick>1447819249</TimeTick>
<NodeArgs eType="General" icon="9" nRep="114" >
<Disp><![CDATA["[ Avodart Oral Capsule 0.5 MG ]":Function Call]]></Disp>
</NodeArgs>
</Step>
<Step rID="T56">
<Obj plainTxt="False" ><![CDATA[[ Surfak Oral Capsule 240 MG ].Fire Web Event]]></Obj>
<Details plainTxt="False" ><![CDATA["onClick"]]></Details>
<Time><![CDATA[11/17/2015 - 22:00:49]]></Time>
<TimeTick>1447819249</TimeTick>
<NodeArgs eType="Replay" icon="8" nRep="116" Source="Action1" SourceLine="272" >
<Disp><![CDATA[[ Surfak Oral Capsule 240 MG ].Fire Web Event]]></Disp>
</NodeArgs>
</Step>
<Step rID="T57">
<Obj plainTxt="False" ><![CDATA[[ WebElement ].Exist]]></Obj>
<Details plainTxt="False" ><![CDATA["Object does not exist"]]></Details>
<Time><![CDATA[11/17/2015 - 22:00:50]]></Time>
<TimeTick>1447819250</TimeTick>
<NodeArgs eType="Replay" icon="8" nRep="123" Source="Action1" SourceLine="274" >
<Disp><![CDATA[[ WebElement ].Exist]]></Disp>
</NodeArgs>
</Step>
<Step rID="T58">
<Obj plainTxt="False" ><![CDATA["[ Avodart Oral Capsule 0.5 MG ]":Function Call]]></Obj>
<Details plainTxt="False" ><![CDATA[ChildItem]]></Details>
<Time><![CDATA[11/17/2015 - 22:00:50]]></Time>
<TimeTick>1447819250</TimeTick>
<NodeArgs eType="General" icon="9" nRep="124" >
<Disp><![CDATA["[ Avodart Oral Capsule 0.5 MG ]":Function Call]]></Disp>
</NodeArgs>
</Step>
<Step rID="T59">
<Obj plainTxt="False" ><![CDATA[[ Protein Oral Liquid ].Fire Web Event]]></Obj>
<Details plainTxt="False" ><![CDATA["onClick"]]></Details>
<Time><![CDATA[11/17/2015 - 22:00:50]]></Time>
<TimeTick>1447819250</TimeTick>
<NodeArgs eType="Replay" icon="8" nRep="126" Source="Action1" SourceLine="272" >
<Disp><![CDATA[[ Protein Oral Liquid ].Fire Web Event]]></Disp>
</NodeArgs>
</Step>
<Step rID="T60">
<Obj plainTxt="False" ><![CDATA[[ WebElement ].Exist]]></Obj>
<Details plainTxt="False" ><![CDATA["Object does not exist"]]></Details>
<Time><![CDATA[11/17/2015 - 22:00:52]]></Time>
<TimeTick>1447819252</TimeTick>
<NodeArgs eType="Replay" icon="8" nRep="133" Source="Action1" SourceLine="274" >
<Disp><![CDATA[[ WebElement ].Exist]]></Disp>
</NodeArgs>
</Step>
<Step rID="T61">
<Obj plainTxt="False" ><![CDATA["[ Avodart Oral Capsule 0.5 MG ]":Function Call]]></Obj>
<Details plainTxt="False" ><![CDATA[ChildItem]]></Details>
<Time><![CDATA[11/17/2015 - 22:00:52]]></Time>
<TimeTick>1447819252</TimeTick>
<NodeArgs eType="General" icon="9" nRep="134" >
<Disp><![CDATA["[ Avodart Oral Capsule 0.5 MG ]":Function Call]]></Disp>
</NodeArgs>
</Step>
<Step rID="T62">
<Obj plainTxt="False" ><![CDATA[[ Aspirin Low Dose Oral Tablet 81 MG ].Fire Web Event]]></Obj>
<Details plainTxt="False" ><![CDATA["onClick"]]></Details>
<Time><![CDATA[11/17/2015 - 22:00:52]]></Time>
<TimeTick>1447819252</TimeTick>
<NodeArgs eType="Replay" icon="8" nRep="136" Source="Action1" SourceLine="272" >
<Disp><![CDATA[[ Aspirin Low Dose Oral Tablet 81 MG ].Fire Web Event]]></Disp>
</NodeArgs>
</Step>
<Step rID="T63">
<Obj plainTxt="False" ><![CDATA[[ WebElement ].Exist]]></Obj>
<Details plainTxt="False" ><![CDATA["Object does not exist"]]></Details>
<Time><![CDATA[11/17/2015 - 22:00:53]]></Time>
<TimeTick>1447819253</TimeTick>
<NodeArgs eType="Replay" icon="8" nRep="143" Source="Action1" SourceLine="274" >
<Disp><![CDATA[[ WebElement ].Exist]]></Disp>
</NodeArgs>
</Step>
<Step rID="T64">
<Obj plainTxt="False" ><![CDATA["[ Avodart Oral Capsule 0.5 MG ]":Function Call]]></Obj>
<Details plainTxt="False" ><![CDATA[ChildItem]]></Details>
<Time><![CDATA[11/17/2015 - 22:00:53]]></Time>
<TimeTick>1447819253</TimeTick>
<NodeArgs eType="General" icon="9" nRep="144" >
<Disp><![CDATA["[ Avodart Oral Capsule 0.5 MG ]":Function Call]]></Disp>
</NodeArgs>
</Step>
<Step rID="T65">
<Obj plainTxt="False" ><![CDATA[[ Renvela Oral Tablet 800 MG ].Fire Web Event]]></Obj>
<Details plainTxt="False" ><![CDATA["onClick"]]></Details>
<Time><![CDATA[11/17/2015 - 22:00:53]]></Time>
<TimeTick>1447819253</TimeTick>
<NodeArgs eType="Replay" icon="8" nRep="146" Source="Action1" SourceLine="272" >
<Disp><![CDATA[[ Renvela Oral Tablet 800 MG ].Fire Web Event]]></Disp>
</NodeArgs>
</Step>
<Step rID="T66">
<Obj plainTxt="False" ><![CDATA[[ WebElement ].Exist]]></Obj>
<Details plainTxt="False" ><![CDATA["Object does not exist"]]></Details>
<Time><![CDATA[11/17/2015 - 22:00:54]]></Time>
<TimeTick>1447819254</TimeTick>
<NodeArgs eType="Replay" icon="8" nRep="153" Source="Action1" SourceLine="274" >
<Disp><![CDATA[[ WebElement ].Exist]]></Disp>
</NodeArgs>
</Step>
<Step rID="T67">
<Obj plainTxt="False" ><![CDATA["[ Avodart Oral Capsule 0.5 MG ]":Function Call]]></Obj>
<Details plainTxt="False" ><![CDATA[ChildItem]]></Details>
<Time><![CDATA[11/17/2015 - 22:00:54]]></Time>
<TimeTick>1447819254</TimeTick>
<NodeArgs eType="General" icon="9" nRep="154" >
<Disp><![CDATA["[ Avodart Oral Capsule 0.5 MG ]":Function Call]]></Disp>
</NodeArgs>
</Step>
<Step rID="T68">
<Obj plainTxt="False" ><![CDATA[[ Epogen Injection Solution 10000 UNIT/ML ].Fire Web Event]]></Obj>
<Details plainTxt="False" ><![CDATA["onClick"]]></Details>
<Time><![CDATA[11/17/2015 - 22:00:54]]></Time>
<TimeTick>1447819254</TimeTick>
<NodeArgs eType="Replay" icon="8" nRep="156" Source="Action1" SourceLine="272" >
<Disp><![CDATA[[ Epogen Injection Solution 10000 UNIT/ML ].Fire Web Event]]></Disp>
</NodeArgs>
</Step>
<Step rID="T69">
<Obj plainTxt="False" ><![CDATA[[ WebElement ].Exist]]></Obj>
<Details plainTxt="False" ><![CDATA["Object does not exist"]]></Details>
<Time><![CDATA[11/17/2015 - 22:00:55]]></Time>
<TimeTick>1447819255</TimeTick>
<NodeArgs eType="Replay" icon="8" nRep="163" Source="Action1" SourceLine="274" >
<Disp><![CDATA[[ WebElement ].Exist]]></Disp>
</NodeArgs>
</Step>